{
  "access_kind": "labels_read",
  "action_id": "A001",
  "dataset_identity": "pcqm4mv2-ogb-fixed-100k-v1",
  "evidence_ref": "experiments/k1_infrastructure_t4_100k/results/optimized/observed_metadata.json",
  "role_event_id": "role-TC-k1-infrastructure-optimized-100k-s42-internal_development-labels_read",
  "role_name": "internal_development",
  "row_manifest_hash": "1b0e8fd579ab1cb86c02e833e7ad284b4af7582b059f912a77853fdccf3ede6d",
  "run_id": "k1-infrastructure-t4-100k-s42-v1:optimized:downstream",
  "schema": "molgap-role-event-v1",
  "selection_used": false,
  "trajectory_id": "TC-k1-infrastructure-optimized-100k-s42"
}
