{
  "schema": "molgap-role-event-v1",
  "role_event_id": "role-TB-gptrans-noisy-nodes-100k-s42-train",
  "trajectory_id": "TB-gptrans-noisy-nodes-100k-s42",
  "action_id": "A001",
  "run_id": "kaseichou/molgap-pcqm-gptrans-noisy-nodes-s42",
  "dataset_identity": "pcqm4mv2-ogb-fixed-100k-v1",
  "row_manifest_hash": "1b0e8fd579ab1cb86c02e833e7ad284b4af7582b059f912a77853fdccf3ede6d",
  "role_name": "official_train_prefix_0_100000",
  "access_kind": "training_membership",
  "selection_used": false,
  "evidence_ref": "experiments/pcqm_gptrans_noisy_nodes_100k/v5_evidence.json"
}