{
  "access_kind": "metric_computed",
  "action_id": "A001",
  "dataset_identity": "1b0e8fd579ab1cb86c02e833e7ad284b4af7582b059f912a77853fdccf3ede6d",
  "evidence_ref": "experiments/pcqm_structural_bias_norm_100k/gptrans/attempt_002/terminal_acceptance/acceptance_resistance.json",
  "role_event_id": "role-TB-pcqm-gptrans-resistance-100k-s42-20261020-resistance-r2-development-metric_computed",
  "role_name": "development",
  "row_manifest_hash": "3270b30071692d712c468fa52fa247d37f0a8e4b5444dc7c913aadb8ca0832c4",
  "run_id": "pcqm-gptrans-resistance-100k-s42-20261020-r2:resistance:downstream",
  "schema": "molgap-role-event-v1",
  "selection_used": false,
  "trajectory_id": "TB-pcqm-gptrans-resistance-100k-s42-20261020-resistance-r2"
}
