{
  "access_kind": "labels_read",
  "action_id": "A001",
  "dataset_identity": "pcqm4mv2-ogb-fixed-500k-scnet-v1",
  "evidence_ref": "experiments/pcqm_k1_scale_attribution_20261025/acceptance.json",
  "role_event_id": "role-k1-scale-attribution-attempt001-train_descriptive",
  "role_name": "train_descriptive",
  "row_manifest_hash": "8fb4d70862858ff04de0e5bdf9f67a1a0b1692c838bd1331cb891e233cbff5d4",
  "run_id": "local-k1-scale-attribution-20261025",
  "schema": "molgap-role-event-v1",
  "selection_used": false,
  "trajectory_id": "TB-k1-scale-attribution-20261025"
}
