{
  "access_kind": "labels_read",
  "action_id": "A001",
  "dataset_identity": "pcqm4mv2-ogb-fixed-100k-v1",
  "evidence_ref": "experiments/pcqm_gptrans_readout_100k/gpu/degree_bond_mean_readout_ema999/results/observed_metadata.json",
  "role_event_id": "role-TC-gptrans-g1-bond-mean-readout-100k-s42-internal_development-labels_read",
  "role_name": "internal_development",
  "row_manifest_hash": "15c8cfbc1bb3376ccf5c80e89f08007c08efb4c6017afee9ea9e12b22bc7b269",
  "run_id": "gptrans-g1-readout-dual-s42:degree_bond_mean_readout_ema999",
  "schema": "molgap-role-event-v1",
  "selection_used": false,
  "trajectory_id": "TC-gptrans-g1-bond-mean-readout-100k-s42"
}
