{
  "schema": "molgap-role-event-v1",
  "role_event_id": "role-TC-k1-cross-scale-full-500k-metric",
  "trajectory_id": "TC-k1-pair-token-frozen-cross-scale-20260924",
  "action_id": "A003",
  "run_id": "122911152",
  "dataset_identity": "630d30046d6cdc1f91fb169cd1eb4720bd5b352dc1ebeb641a11ead1ebae9751",
  "row_manifest_hash": "c329fbde935324118f4f62aa6e2b01b209d6f54642549637853419deb1761c4b",
  "role_name": "internal_development_500k",
  "access_kind": "metric_computed",
  "selection_used": false,
  "evidence_ref": "experiments/pcqm_k1_cross_scale_frozen/results/analysis.json"
}
