{
  "access_kind": "metric_computed",
  "action_id": "A001",
  "dataset_identity": "630d30046d6cdc1f91fb169cd1eb4720bd5b352dc1ebeb641a11ead1ebae9751",
  "evidence_ref": "experiments/pcqm_gptrans_bondlocal_pairnorm_lr_500k/terminal_acceptance/roles_pairnorm_lr5e4_complete.json",
  "role_event_id": "role-pcqm-gptrans-pairnorm-lr-500k-s42-pairnorm_lr5e4-development-metric_computed",
  "role_name": "development",
  "row_manifest_hash": "4299750a50b2a3bd4f03f47f946e7ef15598aaffa13bbbdb416d433a001f37b2",
  "run_id": "pcqm-gptrans-pairnorm-lr-500k-s42:pairnorm_lr5e4:downstream",
  "schema": "molgap-role-event-v1",
  "selection_used": true,
  "trajectory_id": "T-pcqm-gptrans-pairnorm-lr-500k-s42-pairnorm_lr5e4"
}
