{
  "access_kind": "training_membership",
  "action_id": "A001",
  "dataset_identity": "1b0e8fd579ab1cb86c02e833e7ad284b4af7582b059f912a77853fdccf3ede6d",
  "evidence_ref": "experiments/pcqm_k1_norm_exposure_100k/optimization_release1/terminal_acceptance/role_audit_ln_low_lr_warmup.json",
  "role_event_id": "role-TB-pcqm-k1-ln-optimization-160ep-100k-s42-20261021-release1-ln_low_lr_warmup-train-training_membership",
  "role_name": "train",
  "row_manifest_hash": "baa5f49fbad78af4964d9ec7eaf2d6327b2d2ca1f4dcf54e2394dfff2e36d58e",
  "run_id": "pcqm-k1-ln-optimization-160ep-100k-s42-20261021-release1:ln_low_lr_warmup:downstream",
  "schema": "molgap-role-event-v1",
  "selection_used": false,
  "trajectory_id": "TB-pcqm-k1-ln-optimization-160ep-100k-s42-20261021-release1-ln_low_lr_warmup"
}
