{
  "access_kind": "metric_computed",
  "action_id": "A001",
  "dataset_identity": "pcqm4mv2-ogb-fixed-500k-scnet-v1",
  "evidence_ref": "experiments/pcqm_k1_clean_fit_generalization_500k/acceptance.json",
  "role_event_id": "role-k1-clean-fit-generalization-500k-20261009-train_descriptive-metric_computed",
  "role_name": "train_descriptive",
  "row_manifest_hash": "8fb4d70862858ff04de0e5bdf9f67a1a0b1692c838bd1331cb891e233cbff5d4",
  "run_id": "local-k1-clean-fit-generalization-500k-20261009",
  "schema": "molgap-role-event-v1",
  "selection_used": false,
  "trajectory_id": "TB-k1-clean-fit-generalization-500k-20261009"
}
