{
  "access_kind": "metric_computed",
  "action_id": "A001",
  "dataset_identity": "pcqm4mv2-ogb-fixed-100k-v1",
  "evidence_ref": "experiments/pcqm_k1_sparse_triplet_100k/results/terminal_acceptance.json",
  "role_event_id": "role-TC-k1-sparse-triplet-100k-s42-metric-computed",
  "role_name": "internal_development_100000_150000",
  "row_manifest_hash": "1b0e8fd579ab1cb86c02e833e7ad284b4af7582b059f912a77853fdccf3ede6d",
  "run_id": "nvoid912/molgap-k1-sparse-triplet-s42:v1",
  "schema": "molgap-role-event-v1",
  "selection_used": false,
  "trajectory_id": "TC-k1-sparse-triplet-100k-s42"
}
