{
  "access_kind": "labels_read",
  "action_id": "A001",
  "dataset_identity": "1b0e8fd579ab1cb86c02e833e7ad284b4af7582b059f912a77853fdccf3ede6d",
  "evidence_ref": "experiments/pcqm_k1_extremal_readout_100k/role_audit_v2/roles_candidate.json",
  "role_event_id": "role-pcqm-k1-extremal-readout-100k-s42-candidate-development-labels_read",
  "role_name": "development",
  "row_manifest_hash": "3270b30071692d712c468fa52fa247d37f0a8e4b5444dc7c913aadb8ca0832c4",
  "run_id": "pcqm-k1-extremal-readout-100k-s42:candidate:downstream",
  "schema": "molgap-role-event-v1",
  "selection_used": true,
  "trajectory_id": "T-pcqm-k1-extremal-readout-100k-s42-candidate"
}
