{
  "access_kind": "training_membership",
  "action_id": "A001",
  "dataset_identity": "1b0e8fd579ab1cb86c02e833e7ad284b4af7582b059f912a77853fdccf3ede6d",
  "evidence_ref": "experiments/pcqm_gptrans_geometry_channels_100k_kaggle1/prospective_attempt_002/distance_only/terminal_inputs/role_history.json",
  "role_event_id": "role-geometry-distance_only-training_membership-a2",
  "role_name": "official_train_prefix",
  "row_manifest_hash": "fa3d4f91a2ac1a8694e271adc6dab26cd2d47bc592d254262b0fa855db566a8d",
  "run_id": "kaggle1-gptrans-geometry-distance-100k-s42-v2",
  "schema": "molgap-role-event-v1",
  "selection_used": false,
  "trajectory_id": "TB-gptrans-geometry-distance-100k-s42-a2"
}
