{
  "access_kind": "prediction_input",
  "action_id": "A001",
  "dataset_identity": "pcqm4mv2-ogb-fixed-500k-scnet-v1",
  "evidence_ref": "experiments/pcqm_k1_explainability_audit/representation/results/terminal_metadata.json",
  "role_event_id": "role-TC-k1-representation-100k-500k-internal_development_500000_550000-prediction_input",
  "role_name": "internal_development_500000_550000",
  "row_manifest_hash": "afb4c803405f3f567be06642086b39a7b468ea263a2c3e75d9bd060bfc6daca6",
  "run_id": "123315282",
  "schema": "molgap-role-event-v1",
  "selection_used": false,
  "trajectory_id": "TC-k1-representation-100k-500k"
}
