{
  "access_kind": "prediction_input",
  "action_id": "A001",
  "dataset_identity": "pcqm4mv2-ogb-fixed-100k-v1",
  "evidence_ref": "experiments/pcqm_k1_slot_readout_diagnostic/acceptance.json",
  "role_event_id": "role-k1-slot-prediction_input",
  "role_name": "internal_development",
  "row_manifest_hash": "3270b30071692d712c468fa52fa247d37f0a8e4b5444dc7c913aadb8ca0832c4",
  "run_id": "local-k1-slot-readout-20261002",
  "schema": "molgap-role-event-v1",
  "selection_used": true,
  "trajectory_id": "TB-k1-slot-readout-diagnostic-20261002"
}
