{
  "access_kind": "training_membership",
  "action_id": "A001",
  "dataset_identity": "1b0e8fd579ab1cb86c02e833e7ad284b4af7582b059f912a77853fdccf3ede6d",
  "evidence_ref": "experiments/family_topology_t4_100k/terminal_acceptance/acceptance_gptrans_local.json",
  "role_event_id": "role-TB-family-topology-t4-100k-gptrans_local-s42-train",
  "role_name": "train",
  "row_manifest_hash": "baa5f49fbad78af4964d9ec7eaf2d6327b2d2ca1f4dcf54e2394dfff2e36d58e",
  "run_id": "family-topology-t4-100k-s42:gptrans_local:downstream",
  "schema": "molgap-role-event-v1",
  "selection_used": false,
  "trajectory_id": "TB-family-topology-t4-100k-gptrans_local-s42"
}
