{
  "access_kind": "prediction_input",
  "action_id": "A001",
  "dataset_identity": "f1bce8ca0161193341abea04a8920aea425e364348c029b7bd1b219672d1b077",
  "evidence_ref": "experiments/modern2d_100k_formal_screen/results/preflight_terminal_v1/esa_native_v3/acceptance.json",
  "role_event_id": "role-TC-modern2d-formal-100k-esa_native_v3-s42-v1-prediction_input",
  "role_name": "train_100k",
  "row_manifest_hash": "baa5f49fbad78af4964d9ec7eaf2d6327b2d2ca1f4dcf54e2394dfff2e36d58e",
  "run_id": "modern2d-formal-100k-s42-v1:esa_native_v3:downstream",
  "schema": "molgap-role-event-v1",
  "selection_used": false,
  "trajectory_id": "TC-modern2d-formal-100k-esa_native_v3-s42-v1"
}
