{
  "access_kind": "prediction_input",
  "action_id": "A001",
  "dataset_identity": "PCQM4Mv2 OGB fixed 500K/50K cache",
  "evidence_ref": "experiments/pcqm_geometry_reliability_gate/acceptance.json",
  "role_event_id": "role-TB-pcqm-geometry-reliability-20260928-dev-prediction",
  "role_name": "fixed50k_development",
  "row_manifest_hash": "676a506c808402bc16a4437cc02286168239a8dd5de4451e992131eddb4f1b20",
  "run_id": "local-geometry-reliability-screen-20260928",
  "schema": "molgap-role-event-v1",
  "selection_used": true,
  "trajectory_id": "TB-pcqm-geometry-reliability-screen-20260928"
}
